Text,Link
Troubleshoot Communication Failure Through Firewall (Windows),troubleshoot-communication-failure-through-firewall.html
Troubleshoot Cannot Load Shared Object on Target Computer,troubleshoot-cannot-load-shared-object-on-target-computer.html
Troubleshoot Vector CANape Operation,vector-canape-troubleshooting.html
Troubleshoot ETAS Inca Operation,etas-inca-troubleshooting.html
Troubleshoot System Upgrade for R2020b,../ug_upgrade/troubleshoot-system-upgrade-to-r2020b.html
Troubleshoot Missing Real-Time Tab,troubleshoot-missing-real-time-tab.html
Troubleshoot Folder Names with Spaces or Special Characters Halt Model Builds,troubleshoot-folder-names-with-spaces-or-special-characters-halt-model-builds.html
Troubleshoot Model Links to Static Libraries or Shared Objects,troubleshoot-model-links-to-static-libraries-or-shared-objects.html
Troubleshoot Build Error for Accelerator Mode,troubleshoot-build-error-for-accelerator-mode.html
Troubleshoot Long Build Times for Real-Time Application,troubleshoot-long-build-times-for-real-time-application.html
Troubleshoot Working with Persistent Variables,troubleshoot-working-with-persistent-variables.html
Troubleshoot Model Upgrade for R2020b,../ug_upgrade/troubleshoot-model-upgrade-to-r2020b.html
Troubleshoot S-Function Build Upgrade for R2020b,../ug_upgrade/troubleshoot-s-function-build-upgrade-for-r2020b.html
Troubleshoot Parameters Not Accessible by Name,troubleshoot-parameters-not-accessible-by-name.html
Troubleshoot Signals Not Accessible by Name,troubleshoot-signals-not-accessible-by-name.html
"Troubleshoot Signal Data Logging from Nonvirtual Bus, Fixed-Point, and Multidimensional Signals",troubleshoot-signal-data-logging-from-nonvirtual-bus-fixed-point-and-multidimensional-signals.html
Troubleshoot Signal Data Logging from Inport in Referenced Model,troubleshoot-signal-data-logging-from-inport-ref-model.html
Troubleshoot Signal Data Logging from Inport in Referenced Model in Test Harness,troubleshoot-signal-data-logging-from-inport-ref-mode-test-harness.html
Troubleshoot Signal Data Logging from Send and Receive Blocks,troubleshoot-signal-data-logging-from-send-and-receive-blocks.html
Troubleshoot Signals for Streaming or File Logging,troubleshoot-signals-for-streaming-or-file-log-logging.html
Troubleshoot Unsatisfactory Real-Time Performance,troubleshoot-unsatisfactory-real-time-performance.html
Troubleshoot Overloaded CPU from Executing Real-Time Application,troubleshoot-overloaded-cpu-from-executing-real-time-application.html
Troubleshoot Gaps in Streamed Data,troubleshoot-gaps-in-streamed-data.html
Troubleshoot System Upgrade for R2020b,../ug_upgrade/troubleshoot-system-upgrade-to-r2020b.html
Troubleshoot Model Upgrade for R2020b,../ug_upgrade/troubleshoot-model-upgrade-to-r2020b.html
Troubleshoot MATLAB API Call Upgrade for R2020b,../ug_upgrade/troubleshoot-matlab-api-call-upgrade-for-r2020b.html
Find Simulink Real-Time Support,find-simulink-real-time-support.html
Install Simulink Real-Time Software Updates,installing-simulink-real-time-software-updates.html
